{
  "artifactVersion": "1",
  "signalId": "vol-regime",
  "asOf": "2026-07-01",
  "publishedAt": "2026-07-01",
  "source": {
    "name": "CBOE VIX History",
    "url": "https://cdn.cboe.com/api/global/us_indices/daily_prices/VIX_History.csv",
    "note": "Manual extract (v1.15b, 2026-07-02): 2026-07-01 session VIX close 16.59 from official CBOE VIX_History.csv (Close column)."
  },
  "updateFrequency": "daily",
  "dataQuality": "verified_manual",
  "observations": {
    "vixClose": 16.59
  },
  "optionalObservations": {
    "vix9dClose": null,
    "vix3mClose": null,
    "spyRealizedVol21dAnn": null
  }
}
